{"generated_at":"2026-10-23T12:04:06Z","schema_version":1,"ips":[{"ip":"50.16.16.211","country":"US","lat":39.0437,"lng":-77.4875,"source":"feodotracker","malware":"QakBot","port":443,"first_seen":"2025-12-30T13:56:31Z","last_seen":"2026-03-12T00:00:00Z","geo_precision":"city"},{"ip":"162.243.103.246","country":"US","lat":40.7895,"lng":-74.0565,"source":"feodotracker","malware":"Emotet","port":8080,"first_seen":"2022-06-04T21:24:53Z","last_seen":"2026-03-07T00:00:00Z","geo_precision":"city"},{"ip":"27.133.154.218","country":"JP","lat":35.6895,"lng":139.6917,"source":"feodotracker","malware":"QakBot","port":443,"first_seen":"2026-03-04T14:28:39Z","last_seen":"2026-03-05T00:00:00Z","geo_precision":"city"},{"ip":"34.204.119.63","country":"US","lat":39.0437,"lng":-77.4875,"source":"feodotracker","malware":"QakBot","port":443,"first_seen":"2026-01-13T21:41:15Z","last_seen":"2026-03-01T00:00:00Z","geo_precision":"city"},{"ip":"178.62.3.223","country":"GB","lat":51.5085,"lng":-0.1257,"source":"feodotracker","malware":"QakBot","port":443,"first_seen":"2026-02-17T05:41:23Z","last_seen":"2026-02-18T00:00:00Z","geo_precision":"city"}],"attribution":"abuse.ch Feodo Tracker + ThreatFox (botnet C2 / blocklist IPs, published for blocking). Geolocation by IPinfo (https://ipinfo.io), city-level and cached, with a public-domain country-centroid fallback plus deterministic per-IP jitter. IP geolocation is approximate — it reflects hosting/registrar, not operator location.","count":5,"total_before_cap":5,"cap":300,"truncated":false,"dropped_no_geo":0}